[
  {
    "slug": "allen-township",
    "date": "2025-03-04",
    "kind": "minutes",
    "summary": "The Allen Township Trustees received an update on One Energy/One Power Company digging in the township right-of-way on TR215, noting that the Hancock County Engineer has not yet issued a permit to tap into the township catch basin. A letter from One Power Company on this drainage permit issue was received shortly before the meeting but had not yet been read by the Trustees. The Trustees voted to authorize the Allen Township Trustee chairman to approve/authorize the Hancock County Engineer to issue drainage-related permits.",
    "corridor_relevance": "The meeting text references One Energy/One Power Company digging in the township ROW on TR215 and a related unread letter from One Power Company concerning a drainage permit to tap into the township catch basin; no further project purpose or details are stated in the minutes.",
    "decisions": [
      "Minutes of February 6, 2025 approved.",
      "Moved to pay warrants and electronic payments totaling $33,269.33 — Roll call all yes.",
      "Moved to grant Girl Scout Troop request to use Township Center and waive rental fees — Roll call all yes.",
      "Moved to accept Hartman & Sons LLC quote to replace ceiling tiles in station #1 for $14,750.00 — Roll call all yes.",
      "Moved to go forward with conversion to Spectrum for communications — Roll call all yes.",
      "Moved to give the Allen Township Trustee chairman the authority to approve/authorize the Hancock County Engineer to issue drainage related permits — Roll call all yes.",
      "Trustees do not desire to have a hearing on Sheetz's liquor license application.",
      "Moved to adjourn at 9:17 p.m. — Roll call all yes."
    ],
    "parties": [
      "Allen Township Trustees",
      "Cindy Land (Allen Township legal counsel)",
      "Stephanie Foster (on behalf of a Girl Scout Troop)",
      "Fire Chief Hickman",
      "Hartman & Sons LLC",
      "John Weber (volunteer fireman)",
      "Frontier",
      "Spectrum",
      "Tony Humphrey",
      "Flanagan",
      "Clark",
      "Smith (Milford Smith, Jr., Chairman)",
      "One Energy/One Power Company",
      "Hancock County Engineer",
      "Dave Evans",
      "Darrin Rehus",
      "Mark Schimmoeller (Fiscal Officer)",
      "Department of Commerce",
      "Sheetz",
      "Mark J. Schimmoeller"
    ],
    "parcels": [
      "TR215",
      "CR220 and CR99",
      "TR114 and CR140",
      "CR140",
      "SR613"
    ],
    "dollar_figures": [
      "$33,269.33",
      "$14,750.00",
      "$55.00 (monthly service savings)",
      "$2,500 - $3,000 (initial equipment and installation costs)",
      "3.2 mills of inside millage"
    ],
    "hits": [
      "one_power"
    ],
    "citation": {
      "source": "03-04-2025.pdf",
      "source_kind": "document",
      "page": null,
      "pages": null,
      "confidence": "medium",
      "note": null,
      "verified": true
    }
  },
  {
    "slug": "allen-township",
    "date": "2025-12-02",
    "kind": "minutes",
    "summary": "At the December 2, 2025 regular meeting of the Allen Township Trustees, attorney Cindy Land from the Hancock County Prosecutor's Office briefed the Trustees on a legal action filed by One Power Company against the Hancock County Board of Elections concerning ballot language for the Allen Township Zoning Resolution. Judge Jonathan P. Starn issued a Decision and Order (Case No. 2025 CV 00168) on November 4, 2025, ruling the May 6, 2025 Primary Election results regarding the Proposed Allen Township Zoning Plan invalid and void, returning Allen Township to unzoned status. The Board of Elections has filed an appeal and a stay on the ruling, and the Proposed Zoning Plan is ordered to be placed on the May 5, 2026 Primary Election ballot with corrected summary language. All zoning certificates issued July through October 2025 were declared unwarranted and associated fees are being returned.",
    "corridor_relevance": "The meeting connects to the subject \"one_power\" solely because One Power Company filed a complaint (Case No. 2025 CV 00168) against the Hancock County Board of Elections asserting that certified ballot language for the Allen Township Zoning Resolution was incorrect and misleading; the minutes do not name any project, site, or purpose associated with One Power Company beyond this legal filing.",
    "decisions": [
      "Minutes of November 4, 2025 approved.",
      "Flanagan moved to pay outstanding bills totaling $157,977.59; Smith seconded; roll call — all yes.",
      "Flanagan moved to adopt the Amended 2025 Township Annual Permanent Appropriation Resolution (to include OPWC funds of $58,368.08); Smith seconded; roll call — all yes.",
      "Flanagan moved to have Cindy [Land] update the CEDA draft to run for 99 years at 3.0 mills; Smith seconded; roll call — all yes.",
      "A Resolution Declaring Two Proposed Amendments to the Allen Township Zoning Resolution Moot was adopted; Flanagan moved, Smith seconded; roll call — all yes.",
      "Flanagan moved that Danny [Fagan]'s November contract payment be prorated through 11/5/25; Smith seconded; roll call — all yes.",
      "Flanagan moved that for 2026 the Trustees prepare a Payroll Certification Form to allocate salaries between the Gas Tax Fund and the General Fund per Auditor of State Bulletin 2011-007; Smith seconded; roll call — all yes.",
      "Flanagan moved that TR215, TR218, and the cemetery (east of TR229) roads be paved in 2026 using the Hancock County Engineer's coop bidding process; Smith seconded; roll call — all yes.",
      "Flanagan moved to restripe TR215, TR218, TR14, TR114, TR101, TR107 using the Hancock County Engineer's coop bidding process; Smith seconded; roll call — all yes.",
      "Flanagan moved to wedge specific spots on TR142, TR114, TR228; Smith seconded; roll call — all yes.",
      "Trustees set January 6, 2026 at 7:00 p.m. for the 2026 Organizational Meeting.",
      "Flanagan moved to adjourn at 9:16 p.m.; Smith seconded; roll call — all yes."
    ],
    "parties": [
      "Allen Township Trustees",
      "Smith (Trustee / Chairman — Milford Smith)",
      "Flanagan (Trustee)",
      "Mark J. Schimmoeller, Fiscal Officer",
      "Cindy Land, Hancock County Prosecutor's Office",
      "Justin Kahle, Hancock County Prosecutor's Office",
      "Fire Chief Hickman",
      "Allen Township Volunteer Fire Department",
      "Tony Humphrey",
      "One Power Company",
      "Hancock County Board of Elections",
      "Judge Jonathan P. Starn",
      "Jeffries' Antiques",
      "Hancock County Engineer",
      "Danny Fagan, Allen Township zoning consultant",
      "City of Findlay"
    ],
    "parcels": [],
    "dollar_figures": [
      "$157,977.59 (outstanding bills — warrants and electronic payments)",
      "$58,368.08 (OPWC funds granted to resurface TR 114 and TR 281)",
      "$17 per firemen response",
      "$38,318.00 ('Fire-Run' payments)",
      "3.0 mills (CEDA with City of Findlay)"
    ],
    "hits": [
      "one_power"
    ],
    "citation": {
      "source": "12-02-2025.pdf",
      "source_kind": "document",
      "page": null,
      "pages": null,
      "confidence": "medium",
      "note": null,
      "verified": true
    }
  },
  {
    "slug": "allen-township",
    "date": "2026-03-03",
    "kind": "minutes",
    "summary": "At the March 3, 2026 regular meeting of the Allen Township Trustees, the topic of data centers possibly being constructed in the township was discussed, including the possibility of placing a moratorium on data center construction. The Trustees voted to have Cindy Land draft a letter to the Hancock County Commissioners requesting them to place a moratorium on data centers in Allen Township.",
    "corridor_relevance": "The meeting connects to the datacenter subject solely through a discussion of data centers possibly being constructed in Allen Township and a subsequent motion to request a county-level moratorium on data center construction; the minutes do not name any specific datacenter project, developer, or parcel.",
    "decisions": [
      "Clark moved to pay bills totaling $142,123.32; seconded by Flanagan. Roll call - all yes.",
      "Smith moved that the FO be given the authority to pursue having a new web-site created with Shumaker Technology Group; seconded by Clark. Roll call - all yes.",
      "Flanagan moved to accept the quote from Truland Equipment of Napoleon to trade-in the 2022 JD Z930M for a 2026 JD Z930M lawn mower for a boot price of $4,821.11; seconded by Clark. Roll call - all yes.",
      "It was decided that Flanagan and Schimmoeller would meet with OnSite Partners (pka: OneEnergy/OnePower) later that week (not at a public meeting).",
      "Flanagan moved to approve job descriptions for Snow Plow Driver, Maintenance Worker and Janitor; seconded by Smith. Roll call - all yes.",
      "Flanagan moved to approve the Frequent Traveler Policy; seconded by Clark. Roll call - all yes.",
      "Flanagan moved to approve the Tax-Exempt Certificate Use and Sales Tax Policy; seconded by Smith. Roll call - all yes.",
      "Smith moved to adopt a Resolution Adopting a Cybersecurity Policy; seconded by Flanagan. Roll call - all yes.",
      "Smith moved to have Cindy Land draft a letter to the Hancock County Commissioners requesting them to place a moratorium on data centers in Allen Township; seconded by Clark. Roll call - all yes.",
      "Flanagan moved to adjourn at 9:00 p.m.; seconded by Smith. Roll call - all yes."
    ],
    "parties": [
      "Roger Clark, Chairman",
      "Mark J. Schimmoeller, Fiscal Officer",
      "Flanagan (Trustee)",
      "Smith (Trustee)",
      "Keith Breneman",
      "Shumaker Technology Group",
      "Fire Chief Hickman",
      "Tony Humphrey",
      "Truland Equipment of Napoleon",
      "Rachel Rader",
      "Gina Campbell",
      "Denny Bishop",
      "John Griffith",
      "Randy Boes",